{
  "$schema": "../schema/supplier.schema.json",
  "$comment": "Values hand-checked in Live Energy's calculator. No automatic adapter: it runs through a session-based WordPress form.",
  "id": "liveenergy",
  "name": "Live Energy",
  "website": "https://www.liveenergy.nl",
  "tariffUrl": "https://aanmelden.liveenergy.nl",
  "products": {
    "electricity": true,
    "gas": true
  },
  "features": {
    "autoCurtailment": null
  },
  "fields": {},
  "manual": {
    "electricityFixedMonthly": {
      "value": 6.05,
      "vatIncluded": true,
      "verified": true,
      "checkedAt": "2026-09-24",
      "source": "https://aanmelden.liveenergy.nl",
      "note": "Live Energy calculator 'Prijsstructuur en kosten' (product 'Dynamisch B2C KVB (EPEX & TTF)'; asks no address); amounts incl. btw; 'Vaste leveringskosten' € 72,60 per jaar (€ 5,00/month excl.)"
    },
    "electricityMarkup": {
      "value": 0.0242,
      "vatIncluded": true,
      "verified": true,
      "checkedAt": "2026-09-24",
      "source": "https://aanmelden.liveenergy.nl",
      "note": "Live Energy calculator 'Prijsstructuur en kosten' (product 'Dynamisch B2C KVB (EPEX & TTF)'; asks no address); amounts incl. btw; 'Inkoopvergoeding' € 0,02420/kWh (€ 0,02 excl.)"
    },
    "gasFixedMonthly": {
      "value": 6.05,
      "vatIncluded": true,
      "verified": true,
      "checkedAt": "2026-09-24",
      "source": "https://aanmelden.liveenergy.nl",
      "note": "Live Energy calculator 'Prijsstructuur en kosten' (product 'Dynamisch B2C KVB (EPEX & TTF)'; asks no address); amounts incl. btw; 'Vaste leveringskosten' € 72,60 per jaar"
    },
    "gasMarkup": {
      "value": 0.0847,
      "vatIncluded": true,
      "verified": true,
      "checkedAt": "2026-09-24",
      "source": "https://aanmelden.liveenergy.nl",
      "note": "Live Energy calculator 'Prijsstructuur en kosten' (product 'Dynamisch B2C KVB (EPEX & TTF)'; asks no address); amounts incl. btw; 'Inkoopvergoeding' € 0,08470/m³ (€ 0,07 excl.)"
    },
    "feedInDelta": {
      "value": -0.0242,
      "vatIncluded": true,
      "verified": true,
      "checkedAt": "2026-09-24",
      "source": "https://aanmelden.liveenergy.nl",
      "note": "Live Energy calculator 'Prijsstructuur en kosten' (product 'Dynamisch B2C KVB (EPEX & TTF)'; asks no address); amounts incl. btw; 'Inkoopvergoeding teruglevering' € 0,02420/kWh is charged on net feed-in"
    }
  }
}
