{
  "$schema": "../schema/supplier.schema.json",
  "$comment": "Not published: Eneco's calculator answers 'We kunnen je op dit moment geen aanbod doen' for the public test address (Madurodam), 2026-09-24. Its flow uses a server-side shopping basket, so there is no automatic adapter.",
  "id": "eneco",
  "name": "Eneco",
  "website": "https://www.eneco.nl",
  "tariffUrl": "https://www.eneco.nl/duurzame-energie/dynamisch-energiecontract/dynamische-tarieven/",
  "products": {
    "electricity": true,
    "gas": true
  },
  "features": {
    "autoCurtailment": null
  },
  "fields": {},
  "manual": {}
}
