{
  "$schema": "../schema/supplier.schema.json",
  "id": "nextenergy",
  "name": "NextEnergy",
  "website": "https://www.nextenergy.nl",
  "tariffUrl": "https://www.nextenergy.nl/dynamische-energie",
  "products": {
    "electricity": true,
    "gas": true
  },
  "features": {
    "autoCurtailment": true,
    "notes": "App-aansturing om omvormers uit te zetten tijdens negatieve uren."
  },
  "fields": {
    "electricityMarkup": {
      "section": "Je betaalt slechts",
      "labels": [
        "Je betaalt slechts"
      ],
      "range": [
        0,
        0.1
      ],
      "vatIncluded": true,
      "window": 40
    },
    "gasMarkup": {
      "section": "Je betaalt slechts",
      "labels": [
        "per kWh en"
      ],
      "range": [
        0.01,
        0.3
      ],
      "vatIncluded": true,
      "window": 40
    },
    "electricityFixedMonthly": {
      "section": "vaste kosten per aansluiting",
      "labels": [
        "vaste kosten per aansluiting"
      ],
      "range": [
        1,
        20
      ],
      "before": true,
      "window": 30,
      "vatIncluded": true
    },
    "gasFixedMonthly": {
      "section": "vaste kosten per aansluiting",
      "labels": [
        "vaste kosten per aansluiting"
      ],
      "range": [
        1,
        20
      ],
      "before": true,
      "window": 30,
      "vatIncluded": true
    }
  },
  "manual": {
    "electricityMarkup": {
      "value": 0.021,
      "vatIncluded": true,
      "verified": true,
      "checkedAt": "2026-09-24",
      "source": "https://www.nextenergy.nl/dynamische-energie",
      "note": "'2,1 cent per kWh (incl. btw)'"
    },
    "gasMarkup": {
      "value": 0.079,
      "vatIncluded": true,
      "verified": true,
      "checkedAt": "2026-09-24",
      "source": "https://www.nextenergy.nl/dynamische-energie",
      "note": "'7,9 cent per m³ (incl. btw)'"
    },
    "electricityFixedMonthly": {
      "value": 5.99,
      "vatIncluded": true,
      "verified": true,
      "checkedAt": "2026-09-24",
      "source": "https://www.nextenergy.nl/dynamische-energie",
      "note": "'€ 5,99 vaste kosten per aansluiting'; btw assumed included."
    },
    "gasFixedMonthly": {
      "value": 5.99,
      "vatIncluded": true,
      "verified": true,
      "checkedAt": "2026-09-24",
      "source": "https://www.nextenergy.nl/dynamische-energie",
      "note": "Same 'per aansluiting' amount; check whether gas is charged separately."
    },
    "feedInDelta": {
      "value": 0,
      "vatIncluded": true,
      "verified": true,
      "checkedAt": "2026-09-24",
      "source": "https://www.nextenergy.nl/dynamische-energie",
      "note": "Page: 'Bij een dynamisch energiecontract betaal je geen terugleverkosten'."
    }
  }
}
