{
  "$schema": "../schema/supplier.schema.json",
  "$comment": "No verified tariffs yet: this supplier only shows prices in its postcode calculator. It is not published until a calculator adapter or a verified manual value is added (see CONTRIBUTING.md).",
  "id": "vandebron",
  "name": "Vandebron",
  "website": "https://vandebron.nl",
  "tariffUrl": "https://vandebron.nl/energie/energiecontract/dynamisch",
  "products": {
    "electricity": true,
    "gas": true
  },
  "features": {
    "autoCurtailment": null
  },
  "fields": {},
  "manual": {}
}
