{
  "$schema": "../schema/supplier.schema.json",
  "id": "frank",
  "name": "Frank Energie",
  "website": "https://www.frankenergie.nl",
  "tariffUrl": "https://www.frankenergie.nl/nl/dynamisch-energiecontract",
  "products": {
    "electricity": true,
    "gas": true
  },
  "features": {
    "autoCurtailment": true,
    "notes": "Slim Terugleveren: with your permission Frank steers your solar panels (seen in Frank's calculator, 2026-09-24)."
  },
  "calculator": {
    "adapter": "frank-graphql",
    "testAddress": {
      "postcode": "2584RZ",
      "houseNumber": 1,
      "city": "'S-GRAVENHAGE",
      "label": "Madurodam, George Maduroplein 1, Den Haag (public attraction)"
    }
  },
  "fields": {},
  "manual": {
    "electricityFixedMonthly": {
      "value": 7.0,
      "vatIncluded": true,
      "verified": true,
      "checkedAt": "2026-09-24",
      "source": "https://www.frankenergie.nl/nl/dynamisch-energiecontract",
      "note": "Frank signup calculator (test address Madurodam, 2584RZ 1); amounts incl. btw"
    },
    "electricityMarkup": {
      "value": 0.01815,
      "vatIncluded": true,
      "verified": true,
      "checkedAt": "2026-09-24",
      "source": "https://www.frankenergie.nl/nl/dynamisch-energiecontract",
      "note": "Frank signup calculator (test address Madurodam, 2584RZ 1); amounts incl. btw; = € 0,015 excl. btw"
    },
    "gasFixedMonthly": {
      "value": 7.0,
      "vatIncluded": true,
      "verified": true,
      "checkedAt": "2026-09-24",
      "source": "https://www.frankenergie.nl/nl/dynamisch-energiecontract",
      "note": "Frank signup calculator (test address Madurodam, 2584RZ 1); amounts incl. btw"
    },
    "gasMarkup": {
      "value": 0.07986,
      "vatIncluded": true,
      "verified": true,
      "checkedAt": "2026-09-24",
      "source": "https://www.frankenergie.nl/nl/dynamisch-energiecontract",
      "note": "Frank signup calculator (test address Madurodam, 2584RZ 1); amounts incl. btw; = € 0,066 excl. btw"
    },
    "feedInDelta": {
      "value": -0.012705,
      "vatIncluded": true,
      "verified": true,
      "checkedAt": "2026-09-24",
      "source": "https://www.frankenergie.nl/nl/dynamisch-energiecontract",
      "note": "Frank signup calculator (test address Madurodam, 2584RZ 1); amounts incl. btw; PURCHASE_FEE_FEED_IN; = € 0,0105 excl. btw"
    }
  }
}
